{
  "$schema": "http://json-schema.org/draft-07/schema#",
  "$id": "https://clawrocket.dev/contracts/editorial-room/v0/discussion_session.schema.json",
  "title": "DiscussionSession",
  "description": "Editorial-scoped LLM Discussion. talk_kind='editorial_scoped'; hidden from normal Panel Talk lists. See EDITORIAL_ROOM_CONTRACT.md §4.4.",
  "type": "object",
  "additionalProperties": false,
  "definitions": {
    "AgentResponse": {
      "type": "object",
      "additionalProperties": false,
      "required": [
        "agent_profile_id",
        "provider_id",
        "model_id",
        "text",
        "citations",
        "cost_usd",
        "latency_ms",
        "status",
        "error_message"
      ],
      "properties": {
        "agent_profile_id": { "type": "string", "minLength": 1 },
        "provider_id": {
          "type": "string",
          "minLength": 1,
          "description": "e.g., 'anthropic'."
        },
        "model_id": {
          "type": "string",
          "minLength": 1,
          "description": "e.g., 'claude-opus-4-7'."
        },
        "text": {
          "type": "string",
          "maxLength": 204800,
          "description": "Markdown body. §7 cap: 200 KB."
        },
        "citations": {
          "type": "array",
          "items": { "type": "string" },
          "description": "Optional source URLs the model emitted."
        },
        "cost_usd": { "type": "number", "minimum": 0 },
        "latency_ms": { "type": "number", "minimum": 0 },
        "status": {
          "type": "string",
          "enum": ["completed", "errored", "timed_out"]
        },
        "error_message": {
          "anyOf": [{ "type": "null" }, { "type": "string" }]
        }
      }
    },
    "DiscussionTurn": {
      "type": "object",
      "additionalProperties": false,
      "required": [
        "id",
        "user_message",
        "initiator",
        "initiated_action",
        "agent_responses",
        "proposals",
        "retained_for_session",
        "cost_usd",
        "latency_ms",
        "partial_provider_failures",
        "created_at"
      ],
      "properties": {
        "id": { "type": "string", "minLength": 1 },
        "user_message": {
          "anyOf": [{ "type": "null" }, { "type": "string" }],
          "description": "Null when system-initiated (e.g., user clicked a proposal button)."
        },
        "initiator": { "type": "string", "enum": ["user", "system"] },
        "initiated_action": {
          "anyOf": [
            { "type": "null" },
            {
              "type": "string",
              "enum": [
                "create_theme",
                "create_topic",
                "create_point",
                "edit_topic",
                "edit_point",
                "merge_points",
                "park_point",
                "promote_note_to_point",
                "improve_toward_score",
                "research_point",
                "outline_section",
                "outline_section_swap",
                "outline_hook_choice"
              ]
            }
          ],
          "description": "ProposalActionKind per §4.5; aliased to ProposalKind."
        },
        "agent_responses": {
          "type": "array",
          "items": { "$ref": "#/definitions/AgentResponse" }
        },
        "proposals": {
          "type": "array",
          "items": {
            "$ref": "https://clawrocket.dev/contracts/editorial-room/v0/proposal_card.schema.json"
          }
        },
        "retained_for_session": {
          "type": "boolean",
          "description": "User-marked: this turn produced something kept."
        },
        "cost_usd": { "type": "number", "minimum": 0 },
        "latency_ms": { "type": "number", "minimum": 0 },
        "partial_provider_failures": {
          "type": "array",
          "items": { "type": "string" },
          "description": "Names of providers that failed; turn still completed with others."
        },
        "created_at": { "type": "string", "format": "date-time" }
      }
    }
  },
  "required": [
    "id",
    "piece_id",
    "phase",
    "active_object_kind",
    "active_object_ref",
    "active_object_content_hash",
    "setup_version",
    "talk_kind",
    "agent_profile_ids",
    "turns",
    "total_cost_usd",
    "created_at",
    "updated_at"
  ],
  "properties": {
    "id": { "type": "string", "minLength": 1, "description": "ULID." },
    "piece_id": { "type": "string", "minLength": 1 },
    "phase": {
      "type": "string",
      "enum": [
        "theme_topic",
        "points",
        "research",
        "outline",
        "draft",
        "polish"
      ]
    },
    "active_object_kind": {
      "type": "string",
      "enum": ["theme", "topic", "point", "draft", "outline"]
    },
    "active_object_ref": {
      "type": "string",
      "minLength": 1,
      "description": "Slug or revision_id."
    },
    "active_object_content_hash": { "type": "string", "minLength": 1 },
    "setup_version": {
      "type": "integer",
      "minimum": 1,
      "description": "Staling key."
    },
    "talk_kind": {
      "const": "editorial_scoped",
      "description": "Always this value; hidden from Panel Talk lists."
    },
    "agent_profile_ids": {
      "type": "array",
      "items": { "type": "string", "minLength": 1 },
      "description": "From SetupState.llm_room_agent_profile_ids."
    },
    "turns": {
      "type": "array",
      "items": { "$ref": "#/definitions/DiscussionTurn" }
    },
    "total_cost_usd": { "type": "number", "minimum": 0 },
    "created_at": { "type": "string", "format": "date-time" },
    "updated_at": { "type": "string", "format": "date-time" }
  }
}
