{
  "id": "01HXYZDISC001AAAAAAAAAAAAAA",
  "piece_id": "piece_01HXYZ789ABC",
  "phase": "theme_topic",
  "active_object_kind": "topic",
  "active_object_ref": "topic/ai-impact-on-game-dev-how-embracers-writedown-changed-indie-publishing-terms",
  "active_object_content_hash": "sha256:abc123def456789aaaaaaaaaaaaaaaaaaaaaaaaaaaaaaaaaaaaaaaaaaaaaaaa",
  "setup_version": 7,
  "talk_kind": "editorial_scoped",
  "agent_profile_ids": ["agent/argus", "agent/scribe", "agent/mei-cohort"],
  "turns": [
    {
      "id": "01HXYZTURN001AAAAAAAAAAAAAA",
      "user_message": "Where should the angle land — deal-shape or accounting?",
      "initiator": "user",
      "initiated_action": null,
      "agent_responses": [
        {
          "agent_profile_id": "agent/argus",
          "provider_id": "anthropic",
          "model_id": "claude-opus-4-7",
          "text": "The accounting reclassification is the load-bearing piece — without it the deal shape doesn't lock. Lead with the reclassification.",
          "citations": [],
          "cost_usd": 0.018,
          "latency_ms": 4210,
          "status": "completed",
          "error_message": null
        },
        {
          "agent_profile_id": "agent/scribe",
          "provider_id": "anthropic",
          "model_id": "claude-sonnet-4-6",
          "text": "Pushing back: a person needs to land in §2. The reclassification is correct but bloodless. Use the Annapurna note.",
          "citations": [],
          "cost_usd": 0.006,
          "latency_ms": 3120,
          "status": "completed",
          "error_message": null
        },
        {
          "agent_profile_id": "agent/mei-cohort",
          "provider_id": "google",
          "model_id": "gemini-2.5-pro",
          "text": "",
          "citations": [],
          "cost_usd": 0,
          "latency_ms": 9999,
          "status": "timed_out",
          "error_message": "provider timeout after 10000ms"
        }
      ],
      "proposals": [
        {
          "id": "01HXYZPROP001AAAAAAAAAAAAAA",
          "schema_version": "0",
          "source_run_id": "01HXYZRUN001AAAAAAAAAAAAAA",
          "source_skill": "factory_topic_debate",
          "proposal_kind": "promote_note_to_point",
          "target_object": {
            "kind": "topic",
            "ref": "topic/ai-impact-on-game-dev-how-embracers-writedown-changed-indie-publishing-terms"
          },
          "proposed_diff": {
            "promote_note_id": "01HXYZNOTE003CCCCCCCCCCCCC",
            "as_point_kind": "counter"
          },
          "rationale": "The Annapurna counter is a real falsifier — promote it to a Counter-Point so it's argued explicitly in the outline.",
          "agent_attribution": ["agent/argus", "agent/scribe"],
          "status": "pending",
          "user_edit": null,
          "resolved_at": null,
          "resolved_by_user_id": null,
          "resolution_note": null
        }
      ],
      "retained_for_session": false,
      "cost_usd": 0.024,
      "latency_ms": 10100,
      "partial_provider_failures": ["google"],
      "created_at": "2026-04-30T11:42:00.000Z"
    },
    {
      "id": "01HXYZTURN002BBBBBBBBBBBBBB",
      "user_message": null,
      "initiator": "system",
      "initiated_action": "promote_note_to_point",
      "agent_responses": [
        {
          "agent_profile_id": "agent/argus",
          "provider_id": "anthropic",
          "model_id": "claude-opus-4-7",
          "text": "Promotion confirmed. Counter-Point seeded with the Annapurna note; flagged for verification before draft.",
          "citations": [],
          "cost_usd": 0.012,
          "latency_ms": 2800,
          "status": "completed",
          "error_message": null
        }
      ],
      "proposals": [],
      "retained_for_session": true,
      "cost_usd": 0.012,
      "latency_ms": 2800,
      "partial_provider_failures": [],
      "created_at": "2026-04-30T11:43:00.000Z"
    }
  ],
  "total_cost_usd": 0.036,
  "created_at": "2026-04-30T11:42:00.000Z",
  "updated_at": "2026-04-30T11:43:00.000Z"
}
